[
  {
    "hash": "d3665258fee9a693a9e20a88bcfb88e4da51c49aa43f28622626b386b34a92df",
    "tier": "金Doro会员",
    "account_value": "5.00",
    "registration_date": "20251211"
  },
  {
    "hash": "da19e7e1595866f1c7e64a13eea412d1feea32871c6631ac5969f9652859d807",
    "tier": "金Doro会员",
    "account_value": "5.00",
    "registration_date": "20251211"
  },
  {
    "hash": "b307713c4e82675a849d803a2af60ebd7df4302c0fe6cbe26bcd0a770e8d51b8",
    "tier": "金Doro会员",
    "account_value": "5.00",
    "registration_date": "20251211"
  },
  {
    "hash": "84c58f2655953ad9dec4ed8417d0892be0547243b1cf4f2e470d29ffb89b85ed",
    "tier": "银Doro会员",
    "account_value": "9",
    "registration_date": "20251211"
  },
  {
    "hash": "11591d85e84c2fe66f645757ec9ea393371c9e23377b5e60290f881a1b8dc99f",
    "tier": "金Doro会员",
    "account_value": "5.00",
    "registration_date": "20251210"
  },
  {
    "hash": "956fa9f7887bc2ef89bdf1211a043540ec0688ff899ed3298b903470d588d8be",
    "tier": "银Doro会员",
    "account_value": "9.00",
    "registration_date": "20251210"
  },
  {
    "hash": "d917518fc7800e4e665061247d301e124177c9f38b5c8ff7d6d40560f79425e6",
    "tier": "银Doro会员",
    "account_value": "3.00",
    "registration_date": "20251210"
  },
  {
    "hash": "e038c48da60120a18646af4b61ee72bc4c4b225db5127d6652ccf9e6d0d301a4",
    "tier": "金Doro会员",
    "account_value": "5.00",
    "registration_date": "20251209"
  },
  {
    "hash": "823fe4b3e8962ac92d8871fef0f96ff2bf82bf8dec9f66b9738096feb2b04a36",
    "tier": "铜Doro会员",
    "account_value": "3.00",
    "registration_date": "20251209"
  },
  {
    "hash": "f240d0f0fc57148d90a2212b8c786f6db86aef03ed3e7f3f8426440f38822eb4",
    "tier": "金Doro会员",
    "account_value": "5.00",
    "registration_date": "20251209"
  },
  {
    "hash": "f46e63a11889b2569b2d701fdaf3b25a7167a42533648a68be6f4f33be55cb41",
    "tier": "银Doro会员",
    "account_value": "3.00",
    "registration_date": "20251208"
  },
  {
    "hash": "406b318413d33506be52927eba2a2f1c0f306b64376f63bcc0ed885ee9945ac0",
    "tier": "银Doro会员",
    "account_value": "0.40",
    "registration_date": "20251208"
  },
  {
    "hash": "96defa15200b665ba2911160accb88660f6de1f3916f3f2e748fddeeed07bfea",
    "tier": "金Doro会员",
    "account_value": "5.00",
    "registration_date": "20251208"
  },
  {
    "hash": "52aa5c44e4054602ba27544966cce547fcb05a10f3a350a98eed107a6a0118dc",
    "tier": "金Doro会员",
    "account_value": "5.00",
    "registration_date": "20251208"
  },
  {
    "hash": "0714caff6afb8348b3416881e2abcd9ea3463d5defd4cb8bfc4e4fb413a31dff",
    "tier": "金Doro会员",
    "account_value": "5",
    "registration_date": "20251208"
  },
  {
    "hash": "c37589b8fccbbaa2150ffd408f8ffe5c7f3366a53299bcddfa366aa7dc96c42a",
    "tier": "金Doro会员",
    "account_value": "5.00",
    "registration_date": "20251207"
  },
  {
    "hash": "119f3b79b0ed975846d44bd78dbc08c93a617b00ef11f20d557ad51015c0e10d",
    "tier": "金Doro会员",
    "account_value": "5.00",
    "registration_date": "20251206"
  },
  {
    "hash": "dcf165017ef79398d0015866ef0c902535e79c31f8a4088f5a5dfce37619f087",
    "tier": "金Doro会员",
    "account_value": "5",
    "registration_date": "20251206"
  },
  {
    "hash": "c06285a911d3e5f57d09f61961b3d5110f6ec4a668beb0ad20a92fa82ecebc5f",
    "tier": "金Doro会员",
    "account_value": "5",
    "registration_date": "20251206"
  },
  {
    "hash": "437e33178548f9d59739a15786a07e99bb190e80956c4af9a90610299d6d7061",
    "tier": "金Doro会员",
    "account_value": "5.33",
    "registration_date": "20251205"
  },
  {
    "hash": "dbaedfab1255b4020a36fa7bd6344b473d71eec0005c147e19a13171a9a2cc06",
    "tier": "金Doro会员",
    "account_value": "5.00",
    "registration_date": "20251205"
  },
  {
    "hash": "2af3da3396364ed5ed881c88e4c1d3098c3856d3f483f6756a8e240d6bcf27d0",
    "tier": "金Doro会员",
    "account_value": "15.00",
    "registration_date": "20251205"
  },
  {
    "hash": "87ba06db34b612403ffd2a5503abf7e94dcf726b146f1da21ec4cbf53254b61d",
    "tier": "银Doro会员",
    "account_value": "14",
    "registration_date": "20251205"
  },
  {
    "hash": "d61df63f37ba2cd879f051597ff96b7d36b452363e775ec8e0bf696e8027837c",
    "tier": "金Doro会员",
    "account_value": "5",
    "registration_date": "20251205"
  },
  {
    "hash": "a16eae0531f6e991a93218ad0eabc0d27cfb5a1ff7eb1705f4e37855699d5638",
    "tier": "金Doro会员",
    "account_value": "5",
    "registration_date": "20251205"
  },
  {
    "hash": "87f0ac00f522d53b94219890a0c585e619da12740a588ba03a2bb33beb290a26",
    "tier": "金Doro会员",
    "account_value": "5",
    "registration_date": "20251205"
  },
  {
    "hash": "b78d4c46709f70db94b34d32c221d33383b67fe74621ca581cf2bddd70bbdaa1",
    "tier": "银Doro会员",
    "account_value": "3",
    "registration_date": "20251205"
  },
  {
    "hash": "43c1d42c6745a7127f8baefb3db500dcf92ce947fe92adf7bf823eb6a74e909f",
    "tier": "金Doro会员",
    "account_value": "15",
    "registration_date": "20251204"
  },
  {
    "hash": "ef5e84ac4e8c85caad2ffce2b2e398e2d3fefec3a8320252869d93fcc21eb91e",
    "tier": "银Doro会员",
    "account_value": "9",
    "registration_date": "20251204"
  },
  {
    "hash": "2c7aaf422281e359838446655ec7278fa54b694dd5731321a035df817108b80f",
    "tier": "金Doro会员",
    "account_value": "5",
    "registration_date": "20251204"
  },
  {
    "hash": "71b4b6b9911920d9b13b37000cb01f5f6ac472fda5f2b03269ac491a7b73e2c9",
    "tier": "银Doro会员",
    "account_value": "3",
    "registration_date": "20251204"
  },
  {
    "hash": "8a654a198e0def033b735e0cb3ba9e92e1706d034c0bdfe0899471d1dc35cffd",
    "tier": "金Doro会员",
    "account_value": "5",
    "registration_date": "20251203"
  },
  {
    "hash": "21a23e44335ae58afd771d9409da563121c100d032007aa5120d383a90ef89b2",
    "tier": "银Doro会员",
    "account_value": "3",
    "registration_date": "20251203"
  },
  {
    "hash": "3dee95de73e22d27895cd76c30b6b74b0ab3f7e8dc53c8954987165342d6be3c",
    "tier": "金Doro会员",
    "account_value": "5",
    "registration_date": "20251202"
  },
  {
    "hash": "4c624b91ec1bde5396d636e08a817621ac89c7c5970a87034900e2b2414f02cb",
    "tier": "金Doro会员",
    "account_value": "15",
    "registration_date": "20251201"
  },
  {
    "hash": "43d67fb4e59f455a07950c7ff715f0f5cfe4ee5a5d739705d63398e7a57f7996",
    "tier": "金Doro会员",
    "account_value": "9.5",
    "registration_date": "20251201"
  },
  {
    "hash": "aa7cfebb2a38b0b42f0e558e71af1d825f9d6077e363934de6f8b2245dd3f245",
    "tier": "金Doro会员",
    "account_value": "5",
    "registration_date": "20251201"
  },
  {
    "hash": "ca5a27f14a4ab941218e24ae635df2d91be3c3a57be6d368bd035bedcd6f80e6",
    "tier": "金Doro会员",
    "account_value": "5",
    "registration_date": "20251201"
  },
  {
    "hash": "10c5adca9b13d2d726af1df6a8e4b8e6e60422c75ae9d4e70c4a332d29a7ea69",
    "tier": "金Doro会员",
    "account_value": "5",
    "registration_date": "20251201"
  },
  {
    "hash": "c0120934b99f2f2ed1aa92352b892c60e379f5a984842974b03c4e996d0dc7ff",
    "tier": "银Doro会员",
    "account_value": "3",
    "registration_date": "20251201"
  },
  {
    "hash": "09a74a773616b15f68bfc0709be4f463d9b8e436c73c7a838e71113359a79bd7",
    "tier": "银Doro会员",
    "account_value": "36",
    "registration_date": "20251130"
  },
  {
    "hash": "54caf09195a7e6c1d5319772c62e3c5df58a45b615a694c6e66eca0ef06bb552",
    "tier": "金Doro会员",
    "account_value": "5",
    "registration_date": "20251130"
  },
  {
    "hash": "f608f047ad8ec6d02217e0ebda6c9d60403c65c0f4d44d6b2698717bfe61d5ff",
    "tier": "金Doro会员",
    "account_value": "5.17",
    "registration_date": "20251129"
  },
  {
    "hash": "cf4171420277e1157a5d69632896405f6e1764551fed6d33cb78bc0733d9cc46",
    "tier": "金Doro会员",
    "account_value": "5",
    "registration_date": "20251129"
  },
  {
    "hash": "5258c9fce953b78c6ab845a15f2aa1000af677aeeb95be132fbf2ef0758508b7",
    "tier": "金Doro会员",
    "account_value": "5",
    "registration_date": "20251129"
  },
  {
    "hash": "bbb97e2f9bb41cf6378b140daafcfe58e5bfd416aabd86b48394fcf077530355",
    "tier": "银Doro会员",
    "account_value": "3",
    "registration_date": "20251129"
  },
  {
    "hash": "def6d5acea6136a25fd4ec9c7862e8bc8e606eef74d074fce4488aa373308747",
    "tier": "金Doro会员",
    "account_value": "6.3",
    "registration_date": "20251128"
  },
  {
    "hash": "329bbc4010b4d0c1de9ba91741832a51e1098f13db576b6d0d449be275b885f4",
    "tier": "金Doro会员",
    "account_value": "5",
    "registration_date": "20251128"
  },
  {
    "hash": "ff3b4b122e0bc19eb8413390210b25951593a800f7a1fb7c36641e3fc10cdc83",
    "tier": "金Doro会员",
    "account_value": "5",
    "registration_date": "20251128"
  },
  {
    "hash": "d18887ea5a90c4d0419054ab6b4d0634fa2f95f5e11a5d23ed3b04b64f23ae7e",
    "tier": "铜Doro会员",
    "account_value": "6",
    "registration_date": "20251127"
  },
  {
    "hash": "ef99fe9445db1260045a1b74147786d6af100cce348a3a74b35a4d25305f106a",
    "tier": "金Doro会员",
    "account_value": "5",
    "registration_date": "20251127"
  },
  {
    "hash": "9430161f2c0bb1ff332d936b6e208a357687d001e22f5b02188730e87d769195",
    "tier": "银Doro会员",
    "account_value": "9",
    "registration_date": "20251126"
  },
  {
    "hash": "9c3fa1b10dc671d7ea3ef84d5f60115c17ac98f6ffe1e900807d09417f6f3864",
    "tier": "金Doro会员",
    "account_value": "5",
    "registration_date": "20251126"
  },
  {
    "hash": "03a28bd8560f48525ccf47b41a9d10d6d921f695911a34584692858081fc274c",
    "tier": "金Doro会员",
    "account_value": "5",
    "registration_date": "20251126"
  },
  {
    "hash": "be71ee225bbcce96145bd7bd93801adde7c2bc47e62e368adc2a54e218097ae5",
    "tier": "银Doro会员",
    "account_value": "3",
    "registration_date": "20251126"
  },
  {
    "hash": "be6bb43f2a3290991c8d9138e2587330c1bb491a118935aef703c46f83e01a19",
    "tier": "金Doro会员",
    "account_value": "25",
    "registration_date": "20251125"
  },
  {
    "hash": "896f5ff33472f2a8666785c33f5c102844532f79fb121115c4781aa8ee31f2c0",
    "tier": "银Doro会员",
    "account_value": "9",
    "registration_date": "20251125"
  },
  {